{
  "claim_boundary": {
    "current_evidence": true,
    "production_admission": false,
    "public_claim_allowed": false,
    "rationale": "Fresh loaded-workstation local-proxy evidence only; no facility, target-hardware, scientific-validation, production, or hardware-neutral performance claim.",
    "scientific_admission": false
  },
  "dependency_lock_sha256": "aaeb571d21524326c91fd6aef53e17bc57778a0803371a29cd41373b09120fef",
  "evidence_class": "local_proxy",
  "failures": [
    "loaded_workstation_orientation_only",
    "public_claim_not_admitted",
    "physics_traceability"
  ],
  "host": {
    "class": "workstation-x86_64-intel-i5-11600K",
    "id": "aaarthuus",
    "kernel": "7.0.0-28-generic",
    "loaded": true,
    "producer_context": {
      "command": "python validation/benchmark_differentiable_scenario.py --json-out artifacts/validation_refreshes/2026-08-27/differentiable/raw.json --md-out artifacts/validation_refreshes/2026-08-27/differentiable/raw.md",
      "durations_ms": [
        367.51548503525555,
        346.1022019619122,
        390.23526199162006,
        356.8805590039119,
        325.99966903217137
      ],
      "isolation": "local_non_isolated_admission_smoke",
      "loadavg_after": [
        22.80126953125,
        16.380859375,
        15.64404296875
      ],
      "loadavg_before": [
        22.609375,
        16.23486328125,
        15.59326171875
      ],
      "timed_runs": 5,
      "warmup_runs": 1
    }
  },
  "lineage_id": "differentiable",
  "orientation_only": true,
  "payload_sha256": "c21499098df972c4ce08eaf3ce6f083c4e58543df3bc95377327e413aaf83346",
  "producer_command": "env PYTHONPATH=src .venv/bin/python validation/benchmark_differentiable_scenario.py --json-out artifacts/validation_refreshes/2026-08-27/differentiable/raw.json --md-out artifacts/validation_refreshes/2026-08-27/differentiable/raw.md",
  "producer_payload": {
    "benchmark_context": {
      "command": "python validation/benchmark_differentiable_scenario.py --json-out artifacts/validation_refreshes/2026-08-27/differentiable/raw.json --md-out artifacts/validation_refreshes/2026-08-27/differentiable/raw.md",
      "durations_ms": [
        367.51548503525555,
        346.1022019619122,
        390.23526199162006,
        356.8805590039119,
        325.99966903217137
      ],
      "isolation": "local_non_isolated_admission_smoke",
      "loadavg_after": [
        22.80126953125,
        16.380859375,
        15.64404296875
      ],
      "loadavg_before": [
        22.609375,
        16.23486328125,
        15.59326171875
      ],
      "timed_runs": 5,
      "warmup_runs": 1
    },
    "campaign_metadata": {
      "backend": "jax",
      "dt": 0.0008,
      "dtype": "float64",
      "equilibrium_param_count": 2,
      "equilibrium_params": [
        1.3,
        0.7
      ],
      "flux_grid_shape": [
        13,
        16
      ],
      "gradient_tolerance": 0.0005,
      "inputs_sha256": "f8de9a97edc80f80b9111cbade1b59c19c7f06413cdba4e8006d700a162679c6",
      "jax_enable_x64": true,
      "n_rho": 16,
      "n_steps": 3,
      "schema_version": 1
    },
    "claim_status": "bounded coupled differentiable scenario evidence only; full-fidelity claim remains blocked",
    "gradient_audit": {
      "checked_param_indices": [
        0,
        1
      ],
      "checked_source_indices": [
        [
          0,
          0,
          1
        ],
        [
          2,
          1,
          8
        ],
        [
          1,
          2,
          14
        ]
      ],
      "epsilon": 1e-05,
      "loss": 0.00013296039827647148,
      "param_max_abs_error": 1.9115416037161423e-15,
      "passed": true,
      "source_max_abs_error": 1.314359781600334e-13,
      "tolerance": 0.0005
    },
    "readiness": {
      "audit_passed": true,
      "backend": "jax",
      "blocked_reasons": [
        "physics_traceability"
      ],
      "campaign_sha256": "181bc074202c985102ac25c40dcc75e4fe8c401bad40a3390ebbd469581a3517",
      "claim_admissible": false,
      "claim_status": "bounded coupled differentiable scenario gradient evidence only",
      "gradient_audit_sha256": "29896a18deae42b2d170dde8c58b791bfae548aa780877e66399593caafa8e0a",
      "gradient_tolerance": 0.0005,
      "latency_p95_ms": 385.69130660034716,
      "schema_version": 1,
      "traceability_passed": false
    },
    "schema_version": "scpn-control.differentiable-scenario-readiness.v1",
    "status": "pass"
  },
  "producers": [
    {
      "path": "validation/benchmark_differentiable_scenario.py",
      "sha256": "446e4c4f7d5b8f268fc85b2d9852668a36d5b42e7da9ddb482d4b3639fbd0b7f"
    }
  ],
  "raw_capture_preserved_in_internal_custody": true,
  "raw_capture_sha256": "2594c80a9c5393050afc531a75b93d3e8da6ff9e6aa876f0b33736e5691255ee",
  "refresh_evidence_time_utc": "2026-08-27T21:35:01Z",
  "sampling": {
    "repeats": 5,
    "samples": 5,
    "warmup": 1
  },
  "schema_version": "scpn-control.validation-report-refresh.v1",
  "source_commit": "61653714a4fa2cc5c90ed59672a6dd3a80d0d967",
  "source_report": {
    "path": "validation/reports/differentiable_scenario_readiness.json",
    "sha256": "e1dee290a81c69de709e97a08249de56344ed514933f7ce0572ea016835de1dd"
  }
}
