{
  "claim_boundary": {
    "current_evidence": true,
    "production_admission": false,
    "public_claim_allowed": false,
    "rationale": "Fresh loaded-workstation local-proxy evidence only; no facility, target-hardware, scientific-validation, production, or hardware-neutral performance claim.",
    "scientific_admission": false
  },
  "dependency_lock_sha256": "aaeb571d21524326c91fd6aef53e17bc57778a0803371a29cd41373b09120fef",
  "evidence_class": "local_proxy",
  "failures": [
    "loaded_workstation_orientation_only",
    "public_claim_not_admitted"
  ],
  "host": {
    "class": "workstation-x86_64-intel-i5-11600K",
    "id": "aaarthuus",
    "kernel": "7.0.0-28-generic",
    "loaded": true,
    "producer_context": {
      "producer_host_context": "not_emitted"
    }
  },
  "lineage_id": "grad_shafranov",
  "orientation_only": true,
  "payload_sha256": "09d5391bee8db9f49a38859f0ed3a39fea79c43de26c1e7540e2266ad5948560",
  "producer_command": "env PYTHONPATH=src python -m validation.validate_grad_shafranov_solovev --target-id aaarthuus-loaded-20260827 --report artifacts/validation_refreshes/2026-08-27/grad_shafranov.json",
  "producer_payload": {
    "generated_utc": "2026-08-27T21:18:06Z",
    "geometry": {
      "a": 0.5,
      "c1": 1.0,
      "c2": 0.5,
      "r0": 1.7,
      "r_max": 2.45,
      "r_min": 0.95,
      "z_max": 0.75,
      "z_min": -0.75
    },
    "min_order": 1.8,
    "multigrid_nrmse_finest": 1.1938899672993093e-06,
    "multigrid_order": 2.018758396413027,
    "multigrid_passed": true,
    "multigrid_records": [
      {
        "converged": true,
        "cycles": 10,
        "initial_residual_inf": 4159.630584308577,
        "mesh_spacing": 0.04687500000000001,
        "nrmse": 1.0969561373499147e-05,
        "residual_inf": 1.471759629723124e-07,
        "resolution": 33
      },
      {
        "converged": true,
        "cycles": 10,
        "initial_residual_inf": 9506.99605469709,
        "mesh_spacing": 0.03125000000000001,
        "nrmse": 4.825542638046743e-06,
        "residual_inf": 4.0732248773878155e-07,
        "resolution": 49
      },
      {
        "converged": true,
        "cycles": 10,
        "initial_residual_inf": 17032.094916464506,
        "mesh_spacing": 0.023437500000000003,
        "nrmse": 2.7005289840973824e-06,
        "residual_inf": 7.770919658867115e-07,
        "resolution": 65
      },
      {
        "converged": true,
        "cycles": 11,
        "initial_residual_inf": 38615.44031059471,
        "mesh_spacing": 0.015625000000000003,
        "nrmse": 1.1938899672993093e-06,
        "residual_inf": 2.260430500555799e-07,
        "resolution": 97
      }
    ],
    "operator_error_finest": 6.10351614893645e-05,
    "operator_error_gate": 0.0005,
    "operator_order": 1.9999999272728683,
    "operator_passed": true,
    "operator_records": [
      {
        "error": 0.0005493164067589262,
        "mesh_spacing": 0.04687500000000001,
        "resolution": 33
      },
      {
        "error": 0.00024414062642108547,
        "mesh_spacing": 0.03125000000000001,
        "resolution": 49
      },
      {
        "error": 0.00013732910260433329,
        "mesh_spacing": 0.023437500000000003,
        "resolution": 65
      },
      {
        "error": 6.10351614893645e-05,
        "mesh_spacing": 0.015625000000000003,
        "resolution": 97
      }
    ],
    "passed": true,
    "payload_sha256": "1c079896eb0af0368f3426ea17f3d944ba39fbf9d25556e229040844ed046314",
    "reconstruction_nrmse_finest": 1.1939229649189492e-06,
    "reconstruction_nrmse_gate": 0.0001,
    "reconstruction_order": 2.018732165798584,
    "reconstruction_passed": true,
    "reconstruction_records": [
      {
        "converged": true,
        "iterations": 651,
        "mesh_spacing": 0.04687500000000001,
        "nrmse": 1.0969371872753927e-05,
        "residual_inf": 1.9237411663652892e-10,
        "resolution": 33
      },
      {
        "converged": true,
        "iterations": 1451,
        "mesh_spacing": 0.03125000000000001,
        "nrmse": 4.825336500499185e-06,
        "residual_inf": 4.432383349239899e-10,
        "resolution": 49
      },
      {
        "converged": true,
        "iterations": 2551,
        "mesh_spacing": 0.023437500000000003,
        "nrmse": 2.7002680112030824e-06,
        "residual_inf": 7.165930071550974e-10,
        "resolution": 65
      },
      {
        "converged": true,
        "iterations": 5701,
        "mesh_spacing": 0.015625000000000003,
        "nrmse": 1.1939229649189492e-06,
        "residual_inf": 9.718208460185451e-10,
        "resolution": 97
      }
    ],
    "resolutions": [
      33,
      49,
      65,
      97
    ],
    "rust_available": false,
    "rust_record": null,
    "schema_version": "scpn-control.grad-shafranov-solovev-validation.v2",
    "target_id": "aaarthuus-loaded-20260827"
  },
  "producers": [
    {
      "path": "validation/validate_grad_shafranov_solovev.py",
      "sha256": "25849d2e3bff3ec96b6c8dd5eeb821b13d6cde6e1cd57d1d7ff4feb3d27bb6f0"
    }
  ],
  "raw_capture_preserved_in_internal_custody": true,
  "raw_capture_sha256": "8487f586abf0f0c682eb11af61b419afcfd9fbc207b74aed41d08e82cb317ffb",
  "refresh_evidence_time_utc": "2026-08-27T21:18:06Z",
  "sampling": {
    "repeats": 1,
    "samples": 3,
    "warmup": 0
  },
  "schema_version": "scpn-control.validation-report-refresh.v1",
  "source_commit": "1cc751776762c5b4b5e2f7836210d52ca4e8b53d",
  "source_report": {
    "path": "validation/reports/grad_shafranov_solovev.json",
    "sha256": "ad33d2224995f54f6b99330be77601614ce6b06161469a65b0f5c1e5a25081c0"
  }
}
